<?xml version="1.0" encoding="UTF-8"?>
<calendar:Calendar xmlns:calendar="http://www.tibco.com/calendar" xmlns:xsi="http://www.w3.org/2001/XMLSchema-instance" xsi:schemaLocation="http://www.tibco.com/calendar ../../model/calendar.xsd ">
  <Name>Default</Name>
  <Locale>default</Locale>
  <DefaultWorkingSchedule>
    <WorkingDay>
      <DayOfWeek>2</DayOfWeek>
    </WorkingDay>
    <WorkingDay>
      <DayOfWeek>3</DayOfWeek>
    </WorkingDay>
    <WorkingDay>
      <DayOfWeek>4</DayOfWeek>
    </WorkingDay>
    <WorkingDay>
      <DayOfWeek>5</DayOfWeek>
    </WorkingDay>
    <WorkingDay>
      <DayOfWeek>6</DayOfWeek>
    </WorkingDay>
    <DefaultWorkingTime>
      <TimeSlot>
        <StartTime>09:00:00</StartTime>
        <EndTime>12:30:00</EndTime>
      </TimeSlot>
      <TimeSlot>
        <StartTime>13:30:00</StartTime>
        <EndTime>17:30:00</EndTime>
      </TimeSlot>
    </DefaultWorkingTime>
  </DefaultWorkingSchedule>
</calendar:Calendar>
